{
    "application": "spack",
    "software": [
        "petsc@3.16.1",
        "gcc@10.2.0",
        "python@3.8.12",
        "openblas@0.3.18",
        "metis@5.1.0"
    ],
    "modules": [
        "slurm"
    ],
    "environment_variables": {
        "LOCAL_TIME": null,
        "UNIX_TIME": null,
        "SYSTEM_NAME": "expanse",
        "SPACK_VERSION": "0.17.2",
        "SPACK_INSTANCE_NAME": "cpu",
        "SPACK_INSTANCE_DIR": "/cm/shared/apps/spack/0.17.2/cpu",
        "SLURM_JOB_SCRIPT": null,
        "SLURM_JOB_MD5SUM": null,
        "SCHEDULER_MODULE": "slurm",
        "SPACK_PACKAGE": "petsc@3.16.1",
        "SPACK_COMPILER": "gcc@10.2.0",
        "SPACK_VARIANTS": "~X ~batch ~cgns ~complex ~cuda ~debug +double ~exodusii ~fftw ~giflib ~hdf5 ~hpddm ~hwloc ~hypre ~int64 ~jpeg ~knl ~libpng ~libyaml ~memkind +metis ~mkl-pardiso ~mmg ~moab ~mpfr ~mpi ~mumps ~openmp ~p4est ~parmmg~ptscotch ~random123 ~rocm ~saws ~scalapack +shared ~strumpack ~suite-sparse ~superlu-dist ~tetgen ~trilinos ~valgrind",
        "SPACK_DEPENDENCIES": "^python@3.8.12/$(spack find --format '{hash:7}' python@3.8.12 % ${SPACK_COMPILER}) ^openblas@0.3.18/$(spack find --format '{hash:7}' openblas@0.3.18 % ${SPACK_COMPILER} ~ilp64 threads=none) ^metis@5.1.0/$(spack find --format '{hash:7}' metis@5.1.0 % ${SPACK_COMPILER})",
        "SPACK_SPEC": "petsc@3.16.1 % gcc@10.2.0 ~X ~batch ~cgns ~complex ~cuda ~debug +double ~exodusii ~fftw ~giflib ~hdf5 ~hpddm ~hwloc ~hypre ~int64 ~jpeg ~knl ~libpng ~libyaml ~memkind +metis ~mkl-pardiso ~mmg ~moab ~mpfr ~mpi ~mumps ~openmp ~p4est ~parmmg~ptscotch ~random123 ~rocm ~saws ~scalapack +shared ~strumpack ~suite-sparse ~superlu-dist ~tetgen ~trilinos ~valgrind ^python@3.8.12/$(spack find --format '{hash:7}' python@3.8.12 % ${SPACK_COMPILER}) ^openblas@0.3.18/$(spack find --format '{hash:7}' openblas@0.3.18 % ${SPACK_COMPILER} ~ilp64 threads=none) ^metis@5.1.0/$(spack find --format '{hash:7}' metis@5.1.0 % ${SPACK_COMPILER})"
    },
    "resources": {
        "gres": null,
        "cpus_per_task": "16",
        "tasks": null,
        "ntasks_per_code": null,
        "gpus": null,
        "gpus_per_node": null,
        "cores_per_socket": null,
        "gpus_per_task": null,
        "exclusive": null,
        "cpus_per_gpu": null,
        "gpu_type": null,
        "time": "00:30:00",
        "ntasks_per_node": "1",
        "nodes": "1",
        "memory": "32G",
        "sockets_per_node": null,
        "ntasks_per_socket": null,
        "mem_per_gpu": null,
        "mem_per_cpu": null,
        "gres_flags": null
    },
    "versions": {
        "petsc": "3.16.1",
        "gcc": "10.2.0",
        "python": "3.8.12",
        "openblas": "0.3.18",
        "metis": "5.1.0"
    }
}